participant,item,feature,explain,purpose,cause,condition,sex,race,age
106,vulture,their bald head and their neck.,their head and neck allow them to feed easier on dead things.  no feathers to get in the way so they stay cleaner.,0,0,biological,female,white / european-american,76
106,bee,the shape of the body,the body is flexible and able to carry nectar to the hive.,0,0,biological,female,white / european-american,76
107,raccoon,the mask and the ringed tail.  also the hand like front paws.,not sure about the mask and tail.  the paws are good for handling small prey like crayfish.,0,0,biological,male,white / european-american,70
107,skunk,"the stripe, tail, and olfactory glands.","not sure about the stripe and tail, but the spray is for protection.",0,0,biological,male,white / european-american,70
107,vulture,"the neck, beak, and wings.",the beak and neck have evolved for the efficient eating of carrion and the wings for soaring for long times.,0,0,biological,male,white / european-american,70
107,bee,the stinger and the eyes.,the stinger is for protection and the eyes for peripheral vision.,0,0,biological,male,white / european-american,70
108,raccoon,"the different colors, the ""bandit"" like look.",the different colors and markings in the fur.,0,0,biological,male,white / european-american,50
108,skunk,"black and white fur, the big tail.","to show it's a skunk, so you know it's a smelly skunk.",0,0,biological,male,white / european-american,50
108,vulture,"the claws, and the beak to eat food (off the road for example).",so it can rip it's prey/food a part easy.,0,0,biological,male,white / european-american,50
108,bee,"the colors for sure, and the stinger.","to show up better, and to have a defense mechanism with the stinger.",0,0,biological,male,white / european-american,50
109,raccoon,the ringed tail and black marks around the eyes are the features that make a raccoon a raccoon.,i'm not sure why it has those features. i'm sure it has something to do with blending in with their surroundings or for safety.,0,0,biological,female,black / african american,34
109,skunk,the black and white coloring along with it's spraying technique are the features that make a skunk a skunk.,the skunk has these features a a defense mechanism.,0,0,biological,female,black / african american,34
109,vulture,"i think the vulture's beak and posture are the features that make the vulture a ""vulture.""",i think those features just highlight how intense looking the animal is. there aren't other animals with distinct features like that that are dedicated to just them.,0,0,biological,female,black / african american,34
109,bee,the bee's stinger and yellow color are it's most important features.,the bee has their stinger for protection. this protects the queen and their hive. i'm not sure for of the reasoning of the color.,0,0,biological,female,black / african american,34
110,raccoon,distinct colors on the face,nature,0,0,biological,male,white / european-american,61
110,skunk,colors and ability to fend off predators with stink,to protect itself,0,0,biological,male,white / european-american,61
110,vulture,long neck and beak,nature,0,0,biological,male,white / european-american,61
110,bee,colors and a stinger,nature,0,0,biological,male,white / european-american,61
111,raccoon,"its dark facial mask, ringed markings on its tail, and its grey color, as well as its very agile front paws which are more like hands.",racoons stay camouflaged most of the time and its coloring helps it in the night to stay hidden. it is a forager and uses its hands to skillfully open containers and other nests and grab things to eat.,0,0,biological,female,white / european-american,63
111,skunk,"a skunks black color with its stark white stripe, its weasel like body, and its stinky anal glands!",skunks camouflage well at night when it goes foraging for food. it is able to move its sleek body through a lot of small spaces. it can protect itself with its smell when provoked.,0,0,biological,female,white / european-american,63
111,vulture,"its neck that slopes downward, its strong beak, and its large wings","it needs to feed on carrion or catch rodents for prey, and it needs a strong beak to capture or tear its prey. it needs to fly stealthily and at higher altitudes to see the panorama below to find its food.",0,0,biological,female,white / european-american,63
111,bee,"its large abdomen, its stinger mechanism, its buzzing sound and wings, and its black and yellow colors.","a bee has these features to be able to fly long distances, to pollinate plants, and to signal other members of its group for certain functions to work or protect the queen.",0,0,biological,female,white / european-american,63
112,raccoon,i believe the dark colored eyes are the most important features of a raccoon.,i really have no idea why they have dark eyes,0,0,biological,male,white / european-american,42
112,skunk,the most distinguishable and recognized feature of a skunk is undoubtedly the strong and intense odor it emits when it is defensive.,i believe it has this feature as a defense mechanism that keeps it safe over time.,0,0,biological,male,white / european-american,42
112,vulture,the most recognized feature of a vulture is that it prays on dead (or soon to be dead) animals.,i believe its nature as a scavenger separates it from other animals. it is willing to simply wait around for other animals to die instead of proactively killing prey.,0,0,biological,male,white / european-american,42
112,bee,the stinger is easily the most important feature of a bee.,"this stinger protects bees from predators, and also makes catching food much easier (i think?)",0,0,biological,male,white / european-american,42
113,raccoon,that they steal garbage.,it needs to steal food because it can't get it any other way that is all it knows,0,0,biological,male,white / european-american,31
113,skunk,it protects itself with a pungent smell,it needs to protect itself with the smell because it doesnt have any other way,0,0,biological,male,white / european-american,31
113,vulture,that it eats the leftovers of other creatures,probably because it can't hunt on its own,0,0,biological,male,white / european-american,31
113,bee,that it pollinates and can sting people,it needs to flourish life and it needs to protect itself with its stinger,0,0,biological,male,white / european-american,31
114,raccoon,hands/paws,the way it is known for using its hands/paws almost humanlike,0,0,biological,male,white / european-american,59
114,skunk,spray oder,protects itself,0,0,biological,male,white / european-american,59
114,vulture,head,no frathers on head so as to not get messy when eating a dead carcus,0,0,biological,male,white / european-american,59
114,bee,stinger,defense,0,0,biological,male,white / european-american,59
115,raccoon,their hands that can grab things and their brain.,they are intelligent enough to get into almost anything and use their almost person like hands to do it.,0,0,biological,male,white / european-american,36
115,skunk,their stripe and stinky spray,the stripe warns you they're a skunk and the spray is their defensive mechanism.,0,0,biological,male,white / european-american,36
115,vulture,their bald head and sense of smell,they can smell dead animals from far away and their baldness lets them get into carcasses easier.,0,0,biological,male,white / european-american,36
115,bee,wings and a stinger,they are always flying around to get nectar and use their sting to protect the hive.,0,0,biological,male,white / european-american,36
116,raccoon,their markings on their face and their way of washing their food before eating it.,they have the mask for camouflage and they wash their food to help them digest it.,0,0,biological,female,white / european-american,NA
116,skunk,the smell and the coloring pattern,they are well known for their distinctive pattern and their ability to spray horrible scent to deter predators.,0,0,biological,female,white / european-american,NA
116,vulture,they help clean the environment of waste.,it helps keep dead animals cleaned up in the wild.,0,0,biological,female,white / european-american,NA
116,bee,their ability to make honey and help pollinate crops.,"we live down from a bee farm and they rent out the bees to farmers to help pollinate their crops. we love the fresh honey this farm sells, also.",0,0,biological,female,white / european-american,NA
117,raccoon,"ringed tail, ""masked"" facial appearance, dextrous paws",it has dextrous paws for foraging and eating; i have no idea why it has the physical traits - striped tail and black eyes - but perhaps for blending into nocturnal environments or attracting mates,0,0,biological,male,white / european-american,53
117,skunk,"black color with a white stripe, ability to spray bad smell",the ability to spray its enemies is a defense mechanism for survival; i have no idea about the purpose of a skunk's color/stripe,0,0,biological,male,white / european-american,53
117,vulture,"it has wings, it has a large,sharp beak, it keen eyesight",it has wings to fly and search for food; it has a large sharp beak for tearing apart and eating flesh; it has keen eyesight to locate food,0,0,biological,male,white / european-american,53
117,bee,"it flies/has wings, it has a stinger, it aids in pollination",it has wings to fly from flower to flower as well as to and from the hive; it has a stinger for self-defense; it aids in pollination because it is part of a bee's symbiotic relationship with the world,0,0,biological,male,white / european-american,53
118,raccoon,it has human like hands/paws.,it needs them for scavenging.,0,0,biological,male,white / european-american,45
118,skunk,it smells.,it uses it for defense.,0,0,biological,male,white / european-american,45
118,vulture,it has large beak and talons.,it uses those for scavenging and tearing into flesh.,0,0,biological,male,white / european-american,45
118,bee,it has a stinger.,it uses the stinger for defense.,0,0,biological,male,white / european-american,45
119,raccoon,its face markings,"because it is nocturnal, the patches of dark and gray make it difficult to see",0,0,biological,female,white / european-american,60
119,skunk,"the white stripes down the back and onto the tail, stinky defense mechanism","it is small and the coloring helps hide it in its habitat, the plumed tail and stinky secretion helps fight off predators",0,0,biological,female,white / european-american,60
119,vulture,"hunched back, big, eats dead things","eating dead things is what its known for, and probably the reason they have such strong beaks (to break bone).",0,0,biological,female,white / european-american,60
119,bee,"black and yellow striped, stinger, very small","it's whole job is to pollinate plants so it has to be small, colored to hide in pollen of plants, stinger for protection",0,0,biological,female,white / european-american,60
120,raccoon,the blacked out eyes and the tail.,im not really sure why it has those features. i guess to protect and blend in.,0,0,biological,female,white / european-american,34
120,skunk,the white stripe,to let people know its going to spray you,0,0,biological,female,white / european-american,34
120,vulture,the way its neck bends,to be able to get its food.,0,0,biological,female,white / european-american,34
120,bee,the color yellow and the black stripes.,to blend in with the flowers.,0,0,biological,female,white / european-american,34
121,raccoon,"it's coloring around the eyes and tail, so basically its fur.","it's given so that people know to stay away from the raccoon, because they are pretty dangerous. it makes it very easy to recognize.",0,0,biological,male,other / prefer not to answer,38
121,skunk,its coloring and tail.,so that you can easily recognize it and stay away from its smell.,0,0,biological,male,other / prefer not to answer,38
121,vulture,it's claws and beak.,so it can tear open its food food more easily.,0,0,biological,male,other / prefer not to answer,38
121,bee,the stinger and wings.,"a defense mechanism, built for protection of the queen bee.",0,0,biological,male,other / prefer not to answer,38
122,raccoon,the dark area around its eyes and the striped tail,"maybe to keep the sun out of its eyes, and i don't know about the tail",0,0,biological,female,white / european-american,62
122,skunk,the contrasting black and white fur,maybe to help it hide from predators,0,0,biological,female,white / european-american,62
122,vulture,all the freaky feathers at the base of its neck and also its big hooked beak,maybe the feathers are for camouflage and the beak's probably to rip into prey,0,0,biological,female,white / european-american,62
122,bee,the giant eye and the yellow color,the eye for seeing and the color maybe for camouflage,0,0,biological,female,white / european-american,62
123,raccoon,it's coloring,help it blend in to its surroundings,0,0,biological,female,white / european-american,37
123,skunk,scent glands,protection from predators,0,0,biological,female,white / european-american,37
123,vulture,beak shape and type,to scavenge and eat road kill/prey,0,0,biological,female,white / european-american,37
123,bee,fuzzy hairs to collect pollen,to make honey and help pollinate plants,0,0,biological,female,white / european-american,37
124,raccoon,the color of its hair. its paws. its tail.,"the color is to camouflage it from predators, its paws are to help it eat and find food, its tail to keep balance.",0,0,biological,male,white / european-american,39
124,skunk,"it's color and stripe, and whatever it is that it sprays.",the spray is to ward off predators and the color is used as camouflage or  a warning.,0,0,biological,male,white / european-american,39
124,vulture,its wings and beak.,its beak to tear open food and its wings to fly to food.,0,0,biological,male,white / european-american,39
124,bee,"wings, stinger, abdomen, and its hair.","the reason it has wings is so it can fly from flower to flower to find its food, the stinger is for protection, the hair i guess is beneficial to the flowers so its food can keep growing.",0,0,biological,male,white / european-american,39
125,raccoon,it's fur colors,i have no idea,0,0,biological,male,white / european-american,31
125,skunk,the fact that it can spray you with a nasty liquid that makes you smell.,it uses the features mentioned above as a defense mechanism.,0,0,biological,male,white / european-american,31
125,vulture,vultures eat dead carcasses.,that is how it eats.,0,0,biological,male,white / european-american,31
125,bee,it takes pollen from flowers and produces honey,it uses these features to function and live it's life.,0,0,biological,male,white / european-american,31
126,raccoon,its claws and color,they use it to camouflage and protect themselves from predators.,0,0,biological,female,latino / hispanic,41
126,skunk,its spray,they use it to protect themselves against predators.,0,0,biological,female,latino / hispanic,41
126,vulture,its claws and beak.,they use it to catch their prey,0,0,biological,female,latino / hispanic,41
126,bee,its stinger,they are able to make honey and also pollinate flowers.,0,0,biological,female,latino / hispanic,41
127,raccoon,"striped tail, claws,","definately a striped tail and clasw for climbing, also fingers similar to monkeys",0,0,biological,female,white / european-american,38
127,skunk,"it fur pattern, fluffy tail, white stripe and that it sprays",its fur makes it easy to tell its a skunk right away. im not sure why it has those features.,0,0,biological,female,white / european-american,38
127,vulture,"ugly, talons, sharp beak",sharp beak to tear apart food,0,0,biological,female,white / european-american,38
127,bee,"color, black and yesllow stripe pattern, stinger","a bee stings, it has that feature to evade predators",0,0,biological,female,white / european-american,38
128,raccoon,the hair coloring on their face,the masked face as well as the ringed tail. this are distinguishing features that makes it easy to identify a raccoon,0,0,biological,male,white / european-american,36
128,skunk,the coloring as well as the signature tail,i think it has these features to blend in with it's surroundings at night,0,0,biological,male,white / european-american,36
128,vulture,the long neck,i think the gaunt features of a vulture are what make them distinguishable. the long neck and the big wings,0,0,biological,male,white / european-american,36
128,bee,the abdomen,"i think it has these features to easily access its hive, and distinguish it from similar species",0,0,biological,male,white / european-american,36
129,raccoon,tail and markings on the face,survival,0,0,biological,female,white / european-american,28
129,skunk,tail,spraying,0,0,biological,female,white / european-american,28
129,vulture,wings and posture,flying and survival,0,0,biological,female,white / european-american,28
129,bee,stinger and wings,to get around and pollinate,0,0,biological,female,white / european-american,28
130,raccoon,it's ability to use it's claws to go through trash cans full of food for survival.,it's bushy tail and the markings on it's tail make is really seen and known.,0,0,biological,female,white / european-american,45
130,skunk,it's ability to spray it's enemies with a nasty stench.,it has it's own scent armor to take care of enemies that it feels threatened by.,0,0,biological,female,white / european-american,45
130,vulture,it's creepy head shape and it's massive wing span and how it's claws are pretty long and sharp. it looks like it is always hungry.,it's got to be rough looking because vultures eat dead things on the road.,0,0,biological,female,white / european-american,45
130,bee,it's stinger helps it against harmful things or places. it makes honey and oxygen possible for us all.,it has a stinger so it can protect itself.,0,0,biological,female,white / european-american,45
131,raccoon,"the most important features that make a raccoon a raccoon include:

distinctive facial markings – especially the black ""mask"" around their eyes, which gives raccoons their signature look.

ringed tail – a bushy tail with alternating dark and light rings.

dexterous front paws – raccoons have incredibly nimble hands, capable of opening containers, manipulating objects, and even unlatching doors.

nocturnal behavior – they're primarily active at night and have excellent night vision.

omnivorous diet – raccoons eat a wide variety of foods, from fruits and insects to small animals and human leftovers.

curiosity and intelligence – they're known for being clever problem-solvers and very adaptable to urban environments.","the black eye mask might reduce glare and help with night vision, giving raccoons an edge as nocturnal foragers.

the ringed tail could help with communication or camouflage in wooded environments.

their dexterous paws evolved because being able to manipulate and open things gave them access to more food sources—key to survival.

their omnivorous diet and intelligence make them incredibly adaptable, which has helped them thrive in both wild and urban settings.

and their nocturnal habits likely developed to avoid predators and human activity, while still having access to food.",0,0,biological,female,white / european-american,28
131,skunk,"distinctive black-and-white coloration – their bold stripes or patterns serve as a warning to predators.

powerful scent glands – located near the tail, these spray a strong, foul-smelling liquid used as a defense mechanism.

stocky body with short legs – built for digging and foraging close to the ground.

nocturnal behavior – skunks are mostly active at night, which helps them avoid predators.

omnivorous diet – they eat a wide variety of foods, including insects, small animals, plants, and fruit.

solitary and slow-moving nature – they typically avoid confrontation, relying on their scent spray as a last resort.","the black-and-white coloration acts as a warning signal (aposematism) to potential predators, advertising that skunks have a powerful and unpleasant defense.

the strong scent glands evolved as an effective chemical defense, deterring predators without the skunk needing to fight or flee.

their stocky body and digging abilities help them find food like insects and small animals underground, increasing their chances of survival.

being nocturnal likely developed to avoid many predators and human activity, while taking advantage of nighttime food sources.

the omnivorous diet makes them adaptable, able to eat whatever is available, which is beneficial in varied environments.

their solitary and slow-moving behavior minimizes unnecessary confrontations, reserving their costly defense spray for real threats.",0,0,biological,female,white / european-american,28
131,vulture,"bald head – lacking feathers on the head and neck helps vultures stay clean when feeding on carcasses.

hooked beak – strong and curved, perfect for tearing through tough skin and muscle of dead animals.

large wings and excellent soaring ability – vultures have broad wings suited for gliding long distances with minimal effort as they search for food.

highly developed sense of smell or sight – depending on the species, vultures use either keen eyesight (old world vultures) or a strong sense of smell (new world vultures) to locate carrion.

scavenging behavior – vultures almost exclusively feed on dead animals, which places them in a unique ecological role as nature’s clean-up crew.

strong digestive system – their stomach acid is powerful enough to kill dangerous bacteria and pathogens found in decaying meat.","the bald head likely evolved because feathers would get dirty and trap bacteria when feeding inside carcasses, so having bare skin helps vultures stay cleaner and avoid infections.

their hooked beak developed to efficiently tear through tough, decomposing flesh.

large wings and soaring ability evolved to allow vultures to cover vast areas with minimal energy, essential for finding rare and scattered food sources.

their keen senses—either sight or smell— are adaptations to quickly locate carcasses from high in the sky or over large distances.

the strong digestive system evolved to neutralize harmful bacteria and toxins in decayed meat, allowing vultures to safely consume food that would be deadly to many other animals.",0,0,biological,female,white / european-american,28
131,bee,"fuzzy body with branched hairs – these help bees collect and carry pollen, making them efficient pollinators.

two pairs of wings – bees have a forewing and hindwing on each side that hook together in flight.

antennae – used for sensing smells, vibrations, and navigation.

pollen-carrying structures – like pollen baskets (corbiculae) on their hind legs, especially in honeybees and bumblebees.

a stinger (in most females) – used for defense, though not all bees can sting.

complex social behavior (in some species) – especially in honeybees, which live in colonies with a queen, workers, and drones.

ability to make and consume nectar and pollen – bees rely on flowers for food and are key pollinators for many plants.","hairy bodies and pollen baskets evolved because bees that could collect and carry more pollen were better at feeding themselves and their offspring, so those traits were passed on.

two pairs of wings provide strong, agile flight—important for traveling between flowers.

antennae became highly sensitive to smells and signals, helping bees find flowers and communicate.

the stinger developed as a defense mechanism, especially in social species where protecting the hive is vital.

social structures, like in honeybee colonies, evolved because cooperation increased survival—bees working together could defend the nest, care for young, and gather more food.

feeding on nectar and pollen shaped their close relationship with flowering plants, leading to co-evolution where both bees and plants adapted to benefit each other.",0,0,biological,female,white / european-american,28
132,raccoon,"the color of their face and their tails, how they can use their paws like hands",the colors i think are for camouflage and the paws are that way to make it easier for them to get the things they need to survive.,0,0,biological,female,white / european-american,38
132,skunk,the strips down their body and the ability to spray something very smelly,"i'm not sure about the stripes unless it's to serve as a warning to other animals, and the smelly part is clearly a defense tactic.",0,0,biological,female,white / european-american,38
132,vulture,size and color,size to deter other animals and color to blend in so they're not disturbed while they're scavenging.,0,0,biological,female,white / european-american,38
132,bee,color and stinger,"well it has the stinger for defense and the color i think even though it's typically yellow and black, is meant for camouflage",0,0,biological,female,white / european-american,38
133,raccoon,"omnivorous diet, facial mask and ringed tail",adaptation for survival the facial mask may reduce glare and improve night vision and evolutionary history their body shape keeps them warm and agile in various habitats,0,0,biological,female,black / african american,37
133,skunk,distinctive black and white coloration and omnivorous diet,defence adaptation of its strong scent that deters predators and their diet and body make them adaptable to various environment,0,0,biological,female,black / african american,37
133,vulture,"bald head and neck, strong beak and scavenger behaviour",their bald head and neck helps keep clean when feeding inside carcasses and they have strong beak to tear tough tides and access meat on carcasses,0,0,biological,female,black / african american,37
133,bee,"body structure, wings, antennae and stinger","survival needs finding food and avoiding danger, ecological role since they are pollinators and evolution",0,0,biological,female,black / african american,37
