participant,item,feature,explain,purpose,cause,condition,sex,race,age
1,clock,"the different hands (second, minute, and hour)",to be able to distinguish a time,0,0,artifact,male,white / european-american,30
1,abacus,the beads attached on the line,to be able to do calculations,0,0,artifact,male,white / european-american,30
1,canopener,way to turn and cut the can in a circle motion,a edge sharp enough to cut into the metal can.,0,0,artifact,male,white / european-american,30
1,carburetor,a filtration system,to be able to run continuously,0,0,artifact,male,white / european-american,30
2,clock,the numbers and hands.,so that we can tell time.,0,0,artifact,female,white / european-american,28
2,abacus,that the balls can move.,so that we can count or keep track of things.,0,0,artifact,female,white / european-american,28
2,canopener,the two circle cutting blades.,to open cans.,0,0,artifact,female,white / european-american,28
2,carburetor,that is has all of the pieces,i don't know much about carbuertors,0,0,artifact,female,white / european-american,28
3,clock,accurate time keeping,it needs to function harmoniously to accurately keep time.,0,0,artifact,female,white / european-american,30
3,abacus,"a quick, visual way to count.","it has rows of beads representing numerical dimensions (ones, tens, hundreds, etc.)",0,0,artifact,female,white / european-american,30
3,canopener,ablitity to open tin cans,i has a cutting wheel that opens tin cans.,0,0,artifact,female,white / european-american,30
3,carburetor,performs it's function to mix air into fuel.,it is a part that performs the task of adding air to fuel to allow the engine/vehicle to run.,0,0,artifact,female,white / european-american,30
4,clock,the hands on it,the actual hands let me know that it is moving and recording time,0,0,artifact,female,white / european-american,48
4,abacus,the balls,so you are able to count the balls,0,0,artifact,female,white / european-american,48
4,canopener,the teeth,it needs the sharp teeth to open up the can,0,0,artifact,female,white / european-american,48
4,carburetor,all of the items make it work,i do not know what it does- so i think that all the components work together to make it run,0,0,artifact,female,white / european-american,48
5,clock,precision,it has to keep accurate time,0,0,artifact,male,white / european-american,42
5,abacus,sliding beads or markers,you have to be able to manipulate it,0,0,artifact,male,white / european-american,42
5,canopener,it has to open cans,that is the definition,0,0,artifact,male,white / european-american,42
5,carburetor,it has to aerate and distribute fuel,that is the definition,0,0,artifact,male,white / european-american,42
6,clock,"in the analog clock above, it would be the minute and hour hands, plus the mechanisms/gears that move them","without the hands in this analog clock, it's just a circular item with numbers on it.  it won't tell time",0,0,artifact,female,white / european-american,43
6,abacus,"i don't know anything about these at all, so i cannot comment.","i don't know anything about these at all, so i cannot comment.",0,0,artifact,female,white / european-american,43
6,canopener,the gear plus the piercing wheel that cuts the can,"without those items, it would not be a can opener at all",0,0,artifact,female,white / european-american,43
6,carburetor,i don't know much about these other than they supply gas to the engine.,i don't know much about these other than they supply gas to the engine.,0,0,artifact,female,white / european-american,43
7,clock,they tell us what time it is,to tell us the time,0,0,artifact,female,white / european-american,52
7,abacus,to learn from,so you can learn,0,0,artifact,female,white / european-american,52
7,canopener,it can open metal,to open a can for us,0,0,artifact,female,white / european-american,52
7,carburetor,making the engine get the right amount of air,to make your car engine run smooth with airflow and gas mixture,0,0,artifact,female,white / european-american,52
8,clock,accuracy,the ability to track the passage of time,0,0,artifact,female,white / european-american,66
8,abacus,ease of use,the ability to add and subtract,0,0,artifact,female,white / european-american,66
8,canopener,gripping the handle correctly to put pressure on the can so that the teeth can open the metal,can't open a can with a toothpick,0,0,artifact,female,white / european-american,66
8,carburetor,ability to mix fuel and air,cars that use gasoline would not be able to function without it,0,0,artifact,female,white / european-american,66
9,clock,"the hands are the most important, and then the numbers.",it has these features to create a measurement of time.,0,0,artifact,male,white / european-american,56
9,abacus,the beads are the most important followed by the metal rods.,the separation of colors on the beads allows one to count.,0,0,artifact,male,white / european-american,56
9,canopener,"the puncturing metal is the most important, followed by the handles.",it has these features so as to facilitate the opening of a can.,0,0,artifact,male,white / european-american,56
9,carburetor,"i don't know the exact function of a carburetor, so i don't know what the most important feature is.","again, i am not well versed on carburetors.",0,0,artifact,male,white / european-american,56
10,clock,analog arms.,i think to capture the exact timing as it keeps ticking every second.,0,0,artifact,male,white / european-american,NA
10,abacus,slidable beads,because without them you can’t keep count,0,0,artifact,male,white / european-american,NA
10,canopener,the blade,makes it easier to open any kind of cans or bottles,0,0,artifact,male,white / european-american,NA
10,carburetor,storage chamber,because it holds the liquod fuel which is very important,0,0,artifact,male,white / european-american,NA
11,clock,the numbers and hands,that it has numbers and hands that move around to the correct time,0,0,artifact,female,white / european-american,49
11,abacus,the rows and little balls,that you can move the little balls around,0,0,artifact,female,white / european-american,49
11,canopener,that it clicks into and pierces the metal can,that it pierces that can and you can move it around the can until it opens,0,0,artifact,female,white / european-american,49
11,carburetor,that it goes in a vehicle,it is needed to make a vehicle work,0,0,artifact,female,white / european-american,49
12,clock,the clocks hands.,as it is used to tell time it's important that the hands are present to show what the time is.,0,0,artifact,female,white / european-american,36
12,abacus,the ability to move the balls for counting.,because it is a mathematical device and being able to count with it is the most important feature.,0,0,artifact,female,white / european-american,36
12,canopener,the rotating wheels to grip and cut.,since it is used for opening cans it is important for it to have rotating sharp edges to cut into the can.,0,0,artifact,female,white / european-american,36
12,carburetor,the mechanisms inside the carburetor.,to perform its duty it must have the proper mechanisms inside to fire off correctly.,0,0,artifact,female,white / european-american,36
13,clock,the numbers and hands,the numbers explain the time,0,0,artifact,female,white / european-american,35
13,abacus,the number of balls and ease of movement,i honestly do not know,0,0,artifact,female,white / european-american,35
13,canopener,the turning/cutting mechanism,to open cans,0,0,artifact,female,white / european-american,35
13,carburetor,every feature,it needs all the features to function,0,0,artifact,female,white / european-american,35
14,clock,the most important feature is that it accurately tells the time.,"a clock is meant to display the time, so it needs to be able to do that.",0,0,artifact,male,white / european-american,50
14,abacus,an abacus needs to represent counting or calculating.,the rack and beads represent an explicit method for counting.,0,0,artifact,male,white / european-american,50
14,canopener,it should cleanly and safely be able to open a can.,i believe this to be self-explanatory. it simply needs to open a can.,0,0,artifact,male,white / european-american,50
14,carburetor,it has to be able to regulate the flow of air in an engine.,it has these features to dynamically control the mixture of air and gas in various conditions to optimize performance.,0,0,artifact,male,white / european-american,50
15,clock,the numbers and the hands.,its ability to tell time.,0,0,artifact,female,white / european-american,20
15,abacus,the beads.,it has the features to perform the function of counting.,0,0,artifact,female,white / european-american,20
15,canopener,"a sharp blade, a good grip on the handle, and a good grip on the can when used.",the intended purpose explains the features.,0,0,artifact,female,white / european-american,20
15,carburetor,the motorized and moving parts.,so it can function efficiently in a car.,0,0,artifact,female,white / european-american,20
16,clock,numbers and the hands,it has to have numbers and some kind of arrow pointing towards the numbers.,0,0,artifact,male,white / european-american,31
16,abacus,the little balls,it has those so that you can play with it.,0,0,artifact,male,white / european-american,31
16,canopener,the blade,it has to have a blade to open the cans.,0,0,artifact,male,white / european-american,31
16,carburetor,the metal,i have no idea what a carburetor even does.,0,0,artifact,male,white / european-american,31
17,clock,the numbers and hands are placed in such a way that you can tell what time it is.,because it's been accepted that this is how we can tell what time it is. i think it's based on a sundial.,0,0,artifact,female,white / european-american,63
17,abacus,the beads are the most important features here.,"it's a long agreed upon approach to calculation. the number of beads and placement on the lines denote something that i can't remember, but they represent numbers and counting...which is what this device is for.",0,0,artifact,female,white / european-american,63
17,canopener,the handles and the round blades are the most important feature as you have to have something to hold on to and also something to cut with.,"for a manual can opener, the way the handle opens up and then squeezes the lip of the can is the way it works. it takes an impossibly closed item, pokes a hole in it, all using physics for leverage.",0,0,artifact,female,white / european-american,63
17,carburetor,"the important features are on the inside, along with that outward facing pipe.",physics and chemistry. something happens inside this device that turned gas into car energy on internal combustion engines.,0,0,artifact,female,white / european-american,63
18,clock,the hands and numbers,to accurately measure the constant change in time.,0,0,artifact,male,black / african american,24
18,abacus,i don't know,i don't know,0,0,artifact,male,black / african american,24
18,canopener,the cutting blade,its primary cutting material is aluminum and metallic cans,0,0,artifact,male,black / african american,24
18,carburetor,regulatory components such as jets.,to ensure vehicle engine has the right air and fuel mixture,0,0,artifact,male,black / african american,24
19,clock,the most important feature is the mechanism that moves the hands.,"what makes a clock a clock are the hands, the mechanism that moves the hands and the face of the clock. all of those parts enable the clock to keep time.",0,0,artifact,female,white / european-american,57
19,abacus,the counting beads.,it has moveable beads so that you can use them to count.,0,0,artifact,female,white / european-american,57
19,canopener,the most important part is the part that cuts the can open.,the parts that make the can opener is the handle and the part that cuts the can open. those features are important so that you can hold the can opener and then open the can.,0,0,artifact,female,white / european-american,57
19,carburetor,i don't know anything about carburetors.,not sure.,0,0,artifact,female,white / european-american,57
20,clock,the numbers as well as the hour and minute hands,"if it didn't have those features, you wouldn't be able to tell time and it wouldn't have any function",0,0,artifact,male,white / european-american,50
20,abacus,the number of beads and rods as well as the number of colors of beads,"the different colors differentiate the lines and without the rods, it would just be a pile of colorful beads",0,0,artifact,male,white / european-american,50
20,canopener,"the circular blade, the serrated circle, and the handle.","the blade cuts the can, the serrated circle turns the can, and the handle applies pressure and force to keep those two engaged",0,0,artifact,male,white / european-american,50
20,carburetor,the fuel intake and exit as well as the internal parts that process the fuel,"fuel has to enter and exit the carburetor and, while the fuel is inside, it gets mixed to become combustible",0,0,artifact,male,white / european-american,50
21,clock,the hands,it has those features to be able to distinguish between the times,0,0,artifact,female,black / african american,33
21,abacus,the beads,the beads make the whole game,0,0,artifact,female,black / african american,33
21,canopener,the circular sharp part - the part that opens the can,"because without having something sharp, you wouldn't be able to pierce the can",0,0,artifact,female,black / african american,33
21,carburetor,i'm not sure what this is,i'm not sure what this is,0,0,artifact,female,black / african american,33
22,clock,"the hands that indicate hour, minute, and second",the ability to record time is why,0,0,artifact,male,white / european-american,32
22,abacus,the beads and the color coding of them,that it is basically an analog calculator,0,0,artifact,male,white / european-american,32
22,canopener,the twisting blade that opens a can,it has a sharp rotating blade which allows you to open a can in a continuous manner,0,0,artifact,male,white / european-american,32
22,carburetor,the fuel jets are by far,because it's involved in supplying gas to an engine,0,0,artifact,male,white / european-american,32
23,clock,the ability to tell and keep time accurately with little to know ambiguity.,"a clock has hands to indicate time of day, which is the most important feature of a clock, additionally, it has numbers to display the time of day.",0,0,artifact,male,white / european-american,26
23,abacus,the counting beads make the most important part of an abacus which allows for counting.,"the abacus has beads which allow for counting, addition, and subtraction with ease.",0,0,artifact,male,white / european-american,26
23,canopener,the ability to open cans with comfort and ease.,"a can opener has functionality to open a can, hence why it is called a can opener. it is made with comfort and ease in mind such that it isn't a pain to use, which would detour you from wanting to use it.",0,0,artifact,male,white / european-american,26
23,carburetor,"the most important feature that makes a carburetor a carburetor is it's ability to properly mix air and fuel for proper combustion, this includes the use of a venturi.",a carburetor has a venturi to allow for the proper atomization of the fuel to create a perfect air-fuel mixture to allow for a complete combustion.,0,0,artifact,male,white / european-american,26
24,clock,"a minute hand, an hour hand, and numbers on its face.",to tell time,0,0,artifact,male,latino / hispanic,45
24,abacus,the movable beads to use in counting.,each bead and each line is a method of counting,0,0,artifact,male,latino / hispanic,45
24,canopener,the ability to open cans,to penetrate the lid and cut along the edge.,0,0,artifact,male,latino / hispanic,45
24,carburetor,the ability to mix air and fuel,"sorry, but i really do not know. i know what it does but i do not know how it does it.",0,0,artifact,male,latino / hispanic,45
25,clock,readability and accuracy,people need to be able to use a clock at variable distances and want it to accurately tell time,0,0,artifact,male,white / european-american,27
25,abacus,its function and ease of use,iterative design and improvements over years,0,0,artifact,male,white / european-american,27
25,canopener,its function and doing it well,its function and purpose,0,0,artifact,male,white / european-american,27
25,carburetor,i do not know what a carburetor is,i do not know what a carburetor is,0,0,artifact,male,white / european-american,27
26,clock,the numbers and hands.,it has those features to be able to inform you of the correct time.,0,0,artifact,female,white / european-american,NA
26,abacus,the beads,being able to count with the beads meads an abacus an abacus.,0,0,artifact,female,white / european-american,NA
26,canopener,the blade for opening the can.,the can opener has a blade in order to open a can.,0,0,artifact,female,white / european-american,NA
26,carburetor,regulation of flow of air and fuel,mixes the fuel and air in order to run the engine,0,0,artifact,female,white / european-american,NA
27,clock,the ability to maintain time,if the clock can keep accurate time then it is the essence of a clock.  anything else is just a set of arms spinning in a circle.,0,0,artifact,male,white / european-american,43
27,abacus,the ability to calculate high numbers,beads that are able to be slid from side to side to keep track of numbers.,0,0,artifact,male,white / european-american,43
27,canopener,the ability to open a can,the knife edge that rotates to cut the can open.,0,0,artifact,male,white / european-american,43
27,carburetor,mixing fuel and air in the correct ratio,it has the ability to mix air and fuel so that the correct amount is added to each cylinder to start and run an engine,0,0,artifact,male,white / european-american,43
28,clock,the different hands of the clock indicating the time.,these features are there so people would know the time.,0,0,artifact,male,white / european-american,41
28,abacus,the beads and being able to move them side to side.,it is a way to be able to calculate numbers.,0,0,artifact,male,white / european-american,41
28,canopener,moving parts to open cans and bottles.,the mechanism which moves and opens items.,0,0,artifact,male,white / european-american,41
28,carburetor,an item that mixes air and fuel entering an engine.,it is meant to power machines.,0,0,artifact,male,white / european-american,41
29,clock,that it has hands that move and point to numbers that mean something,it has those features so that it is functional to people.,0,0,artifact,male,white / european-american,35
29,abacus,that it has beads that help users to count,so that it can be useful to humans,0,0,artifact,male,white / european-american,35
29,canopener,that it has the ability to open cans using a jaw.,so that it can help user in opening cans.,0,0,artifact,male,white / european-american,35
29,carburetor,that it allows an engine to work.,so that it can be functional to people.,0,0,artifact,male,white / european-american,35
30,clock,the second hand,it's precision. there are a lot of parts that make it work,0,0,artifact,male,black / african american,56
30,abacus,the beads and their color,it helps in its precision,0,0,artifact,male,black / african american,56
30,canopener,the teeth and the handle,the teeth and it the turn knob. both are needed to make it work,0,0,artifact,male,black / african american,56
30,carburetor,"its structure and parts, especially it's intake",air has to come in in order for it to work,0,0,artifact,male,black / african american,56
31,clock,numbers and hands,to help teach time to people but also know what time it is,0,0,artifact,female,white / european-american,46
31,abacus,teaches math,its a simple way to teach math to people and its been a proven method for generations,0,0,artifact,female,white / european-american,46
31,canopener,opens can an bottles,assistance tool to open metal cans and has an additional feature to help open bottle tops,0,0,artifact,female,white / european-american,46
31,carburetor,helps the car function,helps with functionality of the vehicle and helps with emitions systems,0,0,artifact,female,white / european-american,46
32,clock,the hands to accurately tell time. the mechanism that keeps it running.,to accurately tell time.,0,0,artifact,female,white / european-american,51
32,abacus,the mechanism/balls to count,to accurately count.,0,0,artifact,female,white / european-american,51
32,canopener,sharpness of the blade,to easily open a can,0,0,artifact,female,white / european-american,51
32,carburetor,i do not know what a carburetor is or does,i am not sure because i do not know what it is or does.,0,0,artifact,female,white / european-american,51
33,clock,the placement of the numbers,because the numbers must be sequential and reset after the 12th.,0,0,artifact,male,white / european-american,57
33,abacus,the placement of the beads,the beads must be placed in such a way to provide consistent calculations,0,0,artifact,male,white / european-american,57
33,canopener,the lever that secures the blade safely.,it must be a closed system that cannot injure with normal usage.,0,0,artifact,male,white / european-american,57
33,carburetor,that it regulates the flow of fuel.,it must be designed in such a way to allow optimal airflow.,0,0,artifact,male,white / european-american,57
34,clock,your hands/ arms(?),so that you can read the numbers and figure out what time it is.,0,0,artifact,female,white / european-american,42
34,abacus,i believe it's to help you add and subtract or solve math problems? from long time ago i believe an asian descented person did it invented it,all i can remember he was used either count or do math.,0,0,artifact,female,white / european-american,42
34,canopener,"get the little sharp gear looking part can open the can, and you are able to get food out of a can easier.",to help you easily open a can of food or a can of something.,0,0,artifact,female,white / european-american,42
34,carburetor,i honestly surprised i knew it was a carburetor before i read the question'cause i'm a girl and i didn't learn about cars. but i guess it does something with gas to get to make the car go. sorry for the dumb answer but i believe i'm not sure exactly what it does.,i think it has something two with gasoline to make the car move,0,0,artifact,female,white / european-american,42
35,clock,this clock has clearly printed numbers and 3 independent hands to display the time. outlined in numbers to represent seconds.,all the combine features on this clock give the necessary tools to tell time on standard time frame.,0,0,artifact,male,white / european-american,40
35,abacus,this abacus provides color coordinated beads for easy identifying multiples for counting.,this abacus makes a simple visual tool for counting. the color-coded beads make for easy identifiable objects to act as numbers.,0,0,artifact,male,white / european-american,40
35,canopener,comfortable grip with round blade and crank for continuous cut.,this can opener has features that provide a consistent safe and easy cut to open any can.,0,0,artifact,male,white / european-american,40
35,carburetor,this carb provides pre-constructed intake for air and fuel jets.,this carburetor offers a solid platform and system for making a vehicle run smoothly.,0,0,artifact,male,white / european-american,40
36,clock,the numbers and the dial,to be effective it needs those features.,0,0,artifact,male,white / european-american,31
36,abacus,the beads and the wire.,it is necessary for an abacus to be functional.,0,0,artifact,male,white / european-american,31
36,canopener,the sharp rotating blades,it was designed to be effective,0,0,artifact,male,white / european-american,31
36,carburetor,the throttle valve.,it has to work well in order to function properly.,0,0,artifact,male,white / european-american,31
37,clock,mechanism that moves the clock hands to tell time,because it is precise and moves forward with the and at a specific rate - once per second,0,0,artifact,male,white / european-american,81
37,abacus,same number of beads on each level,same number of beads on each level and multiple levels,0,0,artifact,male,white / european-american,81
37,canopener,rotating blades and crank with handles for leverage,to open cans,0,0,artifact,male,white / european-american,81
37,carburetor,it mixes air and gas to sned the mix to be burned in cylinders for power,to provide fuel to burn to move the car forward or in reverse,0,0,artifact,male,white / european-american,81
38,clock,time indicators and accuracy,without time indicators you wouldn't know the time. without accuracy you couldn't trust the time displayed,0,0,artifact,male,white / european-american,64
38,abacus,"beads of various colors, a frame with strings","the beads colors represent magnitudes of numbers, the frame and strings organize them to enable calculations",0,0,artifact,male,white / european-american,64
38,canopener,the ability to pierce a lid and to rotate around the lid,because any other way to open a can would be messier and harder,0,0,artifact,male,white / european-american,64
38,carburetor,a component that regulates and disperses gas flow,the right amount and form of gas is necessary for smooth engine operation,0,0,artifact,male,white / european-american,64
39,clock,the hands and the numbers are the most important part to make a clock.,without the numbers and hands you would not have anyway to tell the time.,0,0,artifact,female,white / european-american,59
39,abacus,the frame and the wire holding the pegs.,you need the frame to hold run the wire through to hold the pegs to make it work.,0,0,artifact,female,white / european-american,59
39,canopener,i think that the most important parts are where the blade pushes down in to the can and the handle to turn the wheel that moves the blade to open the can.,it is what makes it open the can. without those features you can not open the can properly.,0,0,artifact,female,white / european-american,59
