participant,item,feature,explain,purpose,cause,condition,sex,race,age
39,carburetor,the choke and the throttle value are most important. the venturi is also important,you need the choke the restrict the airflow and the throttle to control the mixture of air and fuel,0,0,artifact,female,white / european-american,59
40,clock,the clock hands and the numbers,simply because it wouldn't be a clock without the features,0,0,artifact,female,other / prefer not to answer,39
40,abacus,the strings.,the strings and its components. without them one cannot input or output any information/data,0,0,artifact,female,other / prefer not to answer,39
40,canopener,the part that attaches itself to the bottle/can to levarage.,"a cap opener has two arms"" which help control the grabbing part and pull off the opening chip of the can",0,0,artifact,female,other / prefer not to answer,39
40,carburetor,to be honest i have no idea,to be honest i have no idea,0,0,artifact,female,other / prefer not to answer,39
41,clock,"the numbers are organized in a specific way, and the arms move at speeds consistent with certain measurements of time",the measure of time is specific and objective and clocks must function accordingly,0,0,artifact,female,white / european-american,47
41,abacus,the representative items must be movable,it needs to be able to function as a physical representation of numbers,0,0,artifact,female,white / european-american,47
41,canopener,the abilities to grip a can and rotate a blade around the top of it,it is designed specific to open the tops of cans by cutting them,0,0,artifact,female,white / european-american,47
41,carburetor,i do not know enough about carburetors to identify any features,it needs to have whatever features are essential to its functional purpose,0,0,artifact,female,white / european-american,47
42,clock,the actual mechanics of the clock are most important.,it's necessary for the insides of the clock to work for the time to work properly.,0,0,artifact,female,white / european-american,57
42,abacus,all the balls represent numbers so they are very important.,the balls are the most important part of the abacus.,0,0,artifact,female,white / european-american,57
42,canopener,the blade mechanism is the most important feature on the can opener.,it has to have this mechanism or it won't work.,0,0,artifact,female,white / european-american,57
42,carburetor,"a carburetor is an important part of the engine.  without the carburetor, the engine will not function.",i'm afraid i don't know the ins and out of the carburetor.  i just know that it is important to make the engine run.,0,0,artifact,female,white / european-american,57
43,clock,"the numbers, hands and consistent movement of the hands.","these features allow it to move in a predictable way. just by looking at it, you can know what time it is",0,0,artifact,male,asian / asian-american,30
43,abacus,the ability to count and do math visually.,it's a way for people to visualize numbers instead of just having it in their head.,0,0,artifact,male,asian / asian-american,30
43,canopener,gears with a circular blade that allow it to slice metal,these features allow it to cut through metal without the need of a knife to puncture instead,0,0,artifact,male,asian / asian-american,30
43,carburetor,mixing gas and air together.,those features allow the two elements to combine before going into the combustion engine,0,0,artifact,male,asian / asian-american,30
44,clock,"the most important features of a watch are:

dial: displays the time with numbers or markings.
hands: indicate the hours, minutes, and seconds.
internal mechanism: controls the movement of the hands to measure time.
protective case: keeps the mechanism safe.
these features allow the watch to display the time clearly and accurately.","a watch has these characteristics because its primary function is to accurately measure and display time. the dial with numbers or markings makes it easy to read the hours, while the hands display the exact time as they move across the dial. the internal mechanism ensures the hands advance at regular intervals, keeping accurate time. finally, the protective case keeps the entire mechanism safe and prevents external damage. these features work together to fulfill a watch's fundamental function: keeping time.",0,0,artifact,male,white / european-american,41
44,abacus,"
the most important features of an abacus are:

horizontal rods: used to organize the beads.
movable beads: allow counting and calculations.
different colors: help identify numerical values (ones, tens, etc.).
sturdy structure: maintains the order of the beads when moved.
these features allow for visual and practical mathematical operations.","an abacus has these characteristics because its main function is to facilitate mathematical calculations in a visual and practical way. the horizontal rods organize the beads, while the movable beads allow you to represent numbers and perform operations such as addition, subtraction, multiplication, or division. the distinct colors help identify numerical values, simplifying use. the solid structure ensures that the beads stay in place when moved, ensuring precision. these features make the abacus a useful tool for learning and working with numbers.",0,0,artifact,male,white / european-american,41
44,canopener,"a can opener has important features like a turning lever, a cutting knife, and comfortable handles. these features make it easy to open cans: the lever rotates the knife around the can, while the handles provide a secure grip. it's essential for everyday kitchen use.","a can opener has these features because its primary function is to open cans safely and efficiently. the lever and cutting knife are designed to rotate around the can, while the handles provide a comfortable and secure grip. these features make it easy to use in everyday cooking, allowing people to open cans effortlessly and safely.",0,0,artifact,male,white / european-american,41
44,carburetor,"the most important features of a carburetor are:

nozzle: mixes air and fuel to create a homogeneous mixture.
spark array: controls the amount of fuel entering.
main body: houses the moving and regulating parts.
valves: allow for the controlled flow of air and fuel.
these features ensure that the engine receives the proper mixture to function properly.","a carburetor has these characteristics because its main function is to provide a proper mixture of air and fuel to the engine. the nozzle mixes these elements to keep the engine running efficiently. the spark gap controls the amount of fuel, ensuring the mixture is optimal for the engine's needs. the main body houses the moving and regulating parts, while the valves allow a controlled flow of air and fuel. these features work together to ensure the engine receives the correct mixture at all times.",0,0,artifact,male,white / european-american,41
45,clock,a clock's most important feature is it's ability to show time to the user.,it has numerous arms and markers to show the time down to the exact seconds - so it has these details for precision.,0,0,artifact,male,latino / hispanic,35
45,abacus,an abacus has numerous rods and balls to properly count with.,"it has these numerous balls and rods for different ways to calculate, depending on the user's needs.",0,0,artifact,male,latino / hispanic,35
45,canopener,the most important feature would have to be how easily it punctures and removes the lid of a can.,"it usually has strong grips to hold on to, to ensure that a person doesn't drop the can when attempting to open it.",0,0,artifact,male,latino / hispanic,35
45,carburetor,what makes a carburetor a carburetor is its ability to mix air and fuel.,"it would have to be made in a very specific way as it is both durable and fragile in different ways. it has to be durable to endure time but it's also fragile because if made in the wrong way, it would be ineffective and dangerous.",0,0,artifact,male,latino / hispanic,35
46,clock,the numbers which tell you what time it is.,numbers that go up to 12 that show the hours and the minutes.,0,0,artifact,female,white / european-american,53
46,abacus,the beads that go across,the way it helps you count,0,0,artifact,female,white / european-american,53
46,canopener,the ease of the blades cutting the can,it opens a can while you turn the blades.,0,0,artifact,female,white / european-american,53
46,carburetor,"i don't know very much about carburetors, but they help make a car run.",it goes in your car to help it drive.,0,0,artifact,female,white / european-american,53
47,clock,"at least one ""hand"" that can point to marks around the edge of a circular dial.",i think it comes from observing how shadows change with the movement of the sun throughout the day. someone figured out that they could track this with a device (sundial) and this evolved into present day timekeeping devices.,0,0,artifact,female,white / european-american,57
47,abacus,easily moveable pieces for counting,"it was an easy, visual, tangible way to count, track, and calculate sums before modern methods.",0,0,artifact,female,white / european-american,57
47,canopener,a sharp blade to puncture the can top and an effective gear mechanism to guide the blade around the can.,it's necessary to easily remove the top of the can.,0,0,artifact,female,white / european-american,57
47,carburetor,i have no idea what function a carburetor fulfills in a car engine.,i've no idea how this works.,0,0,artifact,female,white / european-american,57
48,clock,telling the time.,it is its inheirent characteristic.,0,0,artifact,female,white / european-american,38
48,abacus,the ability to move beads to use numeracy.,it is it's main task to accomplish.,0,0,artifact,female,white / european-american,38
48,canopener,easy to use and accomplish tasks,it can open cans.,0,0,artifact,female,white / european-american,38
48,carburetor,help cars run.,necessary to make cars run.,0,0,artifact,female,white / european-american,38
49,clock,"hands, numbers, circle",to put together a picture you can make sense of,0,0,artifact,female,white / european-american,34
49,abacus,"beads, wire, wood",to hold the elemtns together,0,0,artifact,female,white / european-american,34
49,canopener,"handle, gear, blade",beacuse those things all make it move together to leverage pressure to open something,0,0,artifact,female,white / european-american,34
49,carburetor,"metal, and i literally don't know",i have no idea how this thing functions or what makes it what,0,0,artifact,female,white / european-american,34
50,clock,hands,the movement indicates time passing,0,0,artifact,male,white / european-american,28
50,abacus,beads and colors,"round is a basic shape easy to manipulate, colors help with keeping track of number representation",0,0,artifact,male,white / european-american,28
50,canopener,wheels and blades,"the metal itself brings to mind metal, the wheels rotation to open",0,0,artifact,male,white / european-american,28
50,carburetor,the areas that connect to other parts to overall machine to run,i really have no explanation other than it looks like an engine and the copper in middle looks important,0,0,artifact,male,white / european-american,28
51,clock,"that it's working, that it has a hour, minute, and second hand.","the hour, minute, second hands, the fact it has 12 hours, and the fact that it keeps running.",0,0,artifact,male,white / european-american,48
51,abacus,"the fact that the pebbles are the same amount, same size.","it has those features so every color can count for a higher number value, 10's 100's 1000's.",0,0,artifact,male,white / european-american,48
51,canopener,"that those teeth gears are strong, because typically mine always wear out, and so then the opener won't move along.","it has the cutting wheel to cut the top of the can lid, and those teeth wheels move it along the can.",0,0,artifact,male,white / european-american,48
51,carburetor,the fact that it let's fuel and air into the combustion chamber.,it has those features to be able to allow the operator the ability to get more or less power from the engine.,0,0,artifact,male,white / european-american,48
52,clock,the hands and gears,the gears and hands tell you the time.,0,0,artifact,male,white / european-american,39
52,abacus,the beads,without the beads it can't be used for counting.,0,0,artifact,male,white / european-american,39
52,canopener,it opens cans with the blades,the blades are needed to cut the metal.,0,0,artifact,male,white / european-american,39
52,carburetor,"not sure, something having to do with gas combustion.",it needs to combust gas to make the car go.,0,0,artifact,male,white / european-american,39
53,clock,the hands and numbers,the hands and numbers let you know what time of day or night it is,0,0,artifact,male,american indian / alaska native,34
53,abacus,the beads,the number of beads and colors to differenciate the category assigned to them,0,0,artifact,male,american indian / alaska native,34
53,canopener,the blades and gears,the blades cut the can. the gears turn the can so it can be cut,0,0,artifact,male,american indian / alaska native,34
53,carburetor,the air intake and fuel to air ratio,the carburetor decides the fuel to air ratio when the engines running,0,0,artifact,male,american indian / alaska native,34
54,clock,its ability to use visuals to tell time,the numbers on its surface help us track time,0,0,artifact,female,asian / asian-american,29
54,abacus,the ability to make individual counts and add things,it helps people count,0,0,artifact,female,asian / asian-american,29
54,canopener,the slicer at the edge that helps open cans,it's goal is to help us open cans,0,0,artifact,female,asian / asian-american,29
54,carburetor,the different intricate pieces and the shape/open tunnel in the middle,"honestly, this is the first time i've seen a carburetor so i'm just going on visuals. i'm surmising that it is supposed to pump some sort of air or fluid, but i don't really know what it does",0,0,artifact,female,asian / asian-american,29
55,clock,"the 12 numbers in correct placement, the hands, hour, minute and second hands. the readability.",to tell time .,0,0,artifact,female,white / european-american,67
55,abacus,10 rows of 10. easily slideable beads,to add or subtract,0,0,artifact,female,white / european-american,67
55,canopener,sharp blade and handle to move it around a can,to open cans and to pop bottle caps,0,0,artifact,female,white / european-american,67
55,carburetor,"no ideaa, maybe to filter the oil",to clean the oil before it goes into the engine,0,0,artifact,female,white / european-american,67
56,clock,it has numbers 1-12 and hands,it has a standardized way to tell time and makes sure that the hands move at the correct rate of time,0,0,artifact,female,white / european-american,53
56,abacus,it has counting beads and guide wires to move them on,it has a way to move the counting beads and keep them in place so they cant slide unless you move them,0,0,artifact,female,white / european-american,53
56,canopener,it has a way to pinch open the metal of the can and clamp down and move around the circumference of the can,to open cans smoothly and easily,0,0,artifact,female,white / european-american,53
56,carburetor,it needs to mix fuel and air correctly,i assume the features ensure correct ratio of air to fuel,0,0,artifact,female,white / european-american,53
57,clock,the hands and numbers,to effectively tell time,0,0,artifact,male,white / european-american,51
57,abacus,the beads used for counting,to be used as a calculator,0,0,artifact,male,white / european-american,51
57,canopener,the blades and the handle,to effectively  open cans,0,0,artifact,male,white / european-american,51
57,carburetor,to supply gas to the engine,to work efficiently with the engine,0,0,artifact,male,white / european-american,51
58,clock,the battery.,if there is no battery then the clock hands will not move and time will not be measured,0,0,artifact,female,black / african american,23
58,abacus,the colors.,it helps distinguish the layers and makes it easier to do the math.,0,0,artifact,female,black / african american,23
58,canopener,the wheels and the clamp for grip,one of the wheels cuts and the other make sure it goes around the can. the clamp is good for grip,0,0,artifact,female,black / african american,23
58,carburetor,the openings,so it can connect to specific pieces in the car. it can not function independently.,0,0,artifact,female,black / african american,23
59,clock,the most important features of a clock are the numbers and the hands on the clock for each measure of time.,clocks have these features so people can tell time accurately.,0,0,artifact,male,white / european-american,23
59,abacus,the different colors to represent various numbers.,it has those features to represent a wide range of numbers for any situation.,0,0,artifact,male,white / european-american,23
59,canopener,the design to fit perfectly onto any can is what makes a can opener a can opener.,it has these features to be able to open an can up with ease.,0,0,artifact,male,white / european-american,23
59,carburetor,the valves and electronics are what makes a carburetor what it is.,it has these features to allow the engine to run smoothly.,0,0,artifact,male,white / european-american,23
60,clock,"showing the correct time and have three needles to show hour, second and minutes",because it is built to display time,0,0,artifact,female,asian / asian-american,40
60,abacus,help someone to get comfortable with numbers,that is what it is meant for,0,0,artifact,female,asian / asian-american,40
60,canopener,open or cut a cap smoothly without much effort.,"it has those features, because that's what it is meant for and build for.",0,0,artifact,female,asian / asian-american,40
60,carburetor,it's role is to mix air and fuel in correct ratio to make vehicle work,"if it is able to perform the above listed function, then it is a carburetor",0,0,artifact,female,asian / asian-american,40
61,clock,"easy to read, keeping time accurately","if a clock cannot show time accurately and be read easily, then it is of no use of a clock as keeping accurate time is its only purpose.",0,0,artifact,female,white / european-american,61
61,abacus,having the right number of balls on each line,it is used for counting.  i'm not really sure how to answer beyond this.,0,0,artifact,female,white / european-american,61
61,canopener,"sharp piece to puncture can, turns easily","if the can cannot be punctured and then the turning mechanism work properly, then it cannot open cans.",0,0,artifact,female,white / european-american,61
61,carburetor,keep a car working properly,i'm not really sure.  i just know they are important part of a car to keep it running smoothly.,0,0,artifact,female,white / european-american,61
62,clock,the numerals and the hands,a clock is a clock because it tells time,0,0,artifact,male,white / european-american,39
62,abacus,the beads and the rods,it has the ability to count things with a mechanical system,0,0,artifact,male,white / european-american,39
62,canopener,the gears and blade,a can opener is a can opener because it opens cans.,0,0,artifact,male,white / european-american,39
62,carburetor,the parts that remove carbon,it is a carburetor because it removes carbon,0,0,artifact,male,white / european-american,39
63,clock,the hands and the numbers,you need both the hands and the numbers to be able to use it to tell time.,0,0,artifact,female,white / european-american,41
63,abacus,the beads you use to count,to be able to function it needs the beads so you can use them to count.,0,0,artifact,female,white / european-american,41
63,canopener,the pieces that make up the can opener allowing it to work,it needs all of the different pieces in order to function as a can opener,0,0,artifact,female,white / european-american,41
63,carburetor,the parts that make up a carburetor are the important parts,you would need all of these parts in order for it to function,0,0,artifact,female,white / european-american,41
64,clock,the numbers one thru twelve.,so you can figure out how to break up segments of time.,0,0,artifact,female,white / european-american,53
64,abacus,the beads that can move side to side.,so you can make calculations with the beads.,0,0,artifact,female,white / european-american,53
64,canopener,the blade that cuts the lid.,to help cut the lid.,0,0,artifact,female,white / european-american,53
64,carburetor,whatever makes it spark.,to make it spark to make the car move.,0,0,artifact,female,white / european-american,53
65,clock,"numbers for hours, numbers for minutes, minute hands, second hands","these features allow me to know what time it currently is, how to plan for upcoming events, and how long i have until time shifts from am to pm.",0,0,artifact,male,white / european-american,37
65,abacus,"wooden base, wooden support columns, metallic rows, small colored balls",these parts allow for simple addition and subtraction tasks for using the math functions of sliding the balls down the metallic rows,0,0,artifact,male,white / european-american,37
65,canopener,"handles, the sharp cutting opener, and the twist dials to lift up the lid","the features allow the can to be hooked into, a slit can be made to perforate the lid, and the dials can be turned to pry open the lid",0,0,artifact,male,white / european-american,37
65,carburetor,"throat valve, air valve, throttle valve",the features of the carburetor allow air and fuel to be mixed into the engine and operate the internal combustion engine of a vehicle.,0,0,artifact,male,white / european-american,37
66,clock,"the red ticker, the numbers and the black tickers",they work together to tell the time,0,0,artifact,female,white / european-american,41
66,abacus,the colors and balls,you have to be able to have colors and balls to count and know colors,0,0,artifact,female,white / european-american,41
66,canopener,the metal edges and the twist knob,it has to be sharp to open the can and has to have a twist knob to turn around the fcan,0,0,artifact,female,white / european-american,41
66,carburetor,i'm unsure on this one but the copper pieces,it helps it work in some way,0,0,artifact,female,white / european-american,41
67,clock,accuracy of time keeping. and legible size numbers,why use a broken clock? why use a tiny clock? not useful to me at all.,0,0,artifact,female,white / european-american,52
67,abacus,it's shorthand few know.,"once you understand how it works, you can use it for most calculations.",0,0,artifact,female,white / european-american,52
67,canopener,easy grip handle and the sharp blade and the angle at which it sits,can my hands use it well? and often does it do a clean job?,0,0,artifact,female,white / european-american,52
67,carburetor,the burn rate and the injector size,what serves the purpose to the most degree?,0,0,artifact,female,white / european-american,52
68,clock,the numbers on the clock that allow it to provide the time.,it has those features so you can easily decipher what time it is.,0,0,artifact,female,black / african american,32
68,abacus,it has beads that are used for counting.,it has those features because it make counting and large equations easier.,0,0,artifact,female,black / african american,32
68,canopener,the most important features that make a can opener a can opener is the mechanism that allows it to open cans easily.,it is designed to be able to open cans easily with a twisting motion.,0,0,artifact,female,black / african american,32
68,carburetor,i think what makes a carburetor a carburetor is the design of the mechanics that impacts its features.,it is specially designed to have those features and that is what makes a carburetor a carburetor as opposed to something like an engine or valve.,0,0,artifact,female,black / african american,32
69,clock,numbers to tell the time. the clock hands to point to #s to tell the time. good batteries and the inside gears and wheels that are built well,so that you can tell what time it is,0,0,artifact,female,white / european-american,38
69,abacus,the bright colors the way the structure is built and will good materials. wooden beads with big enough holes to slide back and forth properly,it can teach colors counting and more,0,0,artifact,female,white / european-american,38
69,canopener,the ability to cut well. sharp cutting edge that cuts the can. safety handle that can be held well. being built with heavy duty materials that don't break so easily as is common in can openers these days.,it has to be able to open a can which is not easily done with just hands.,0,0,artifact,female,white / european-american,38
69,carburetor,i don't know much about a carburetor but it needs to be built with high quality materials to last in a vehicle,it helps the automobile operate properly,0,0,artifact,female,white / european-american,38
70,clock,"the number and placement of tick marks around the circumference.  the two long ""arms""",the hands must revolve around the circumference. the tick marks are necessary so when the arms land on the mark we can tell the time of day.,0,0,artifact,male,white / european-american,49
70,abacus,the number of beads. the horizontals that thread through the beads.,it had a number of beads threaded through horizontal rows in order to count and do maths.,0,0,artifact,male,white / european-american,49
70,canopener,the cutter and gears,the cutter pierces the can. the gears combined with the cutter revolve the can and continue the cut.,0,0,artifact,male,white / european-american,49
70,carburetor,its design and how it works with the other parts of the machine.,it has those features so the machine can function properly.,0,0,artifact,male,white / european-american,49
71,clock,clock hands (needles) that point to the time.,it includes timing symbols or numbers so we can read what time the hands are pointing to.,0,0,artifact,male,asian / asian-american,29
