participant,item,feature,explain,purpose,cause,condition,sex,race,age
71,abacus,"the abacus to represent numbers and perform calculations through the position and movement of beads, making it a manual but effective mathematical tool.




","a frame, rods, beads, and a divider bar because it’s designed to visually and physically represent numbers.",0,0,artifact,male,asian / asian-american,29
71,canopener,"sharp cutting wheel, non slip handles and grip.","a sharp blade, smooth turning mechanism, and sturdy handles make it safe, easy, and effective to open sealed metal cans.",0,0,artifact,male,asian / asian-american,29
71,carburetor,the carburetor’s core function delivering the correct air-fuel mixture to the engine for combustion.,its main purpose is to mix air and fuel in the correct ratio and deliver it to the engine for efficient combustion.,0,0,artifact,male,asian / asian-american,29
72,raccoon,"eye mask, little hands, ringed tail",people know those features,0,0,biological,female,white / european-american,33
72,skunk,"black and white stripe, poofy tail, stinky",those are its defining features,0,0,biological,female,white / european-american,33
72,vulture,bald head and hunch,because they are universally known features,0,0,biological,female,white / european-american,33
72,bee,black and yellow,because everyone recognizes that as a bee,0,0,biological,female,white / european-american,33
73,raccoon,their hands,to grab and eat thinfs,0,0,biological,male,white / european-american,34
73,skunk,the tail,to spray,0,0,biological,male,white / european-american,34
73,vulture,the beak and talons,to eat dead animals,0,0,biological,male,white / european-american,34
73,bee,the stinger,to sting,0,0,biological,male,white / european-american,34
74,raccoon,"striped tail, four legs, sharp claws",it is an animal that needs to scavenge to find food,0,0,biological,female,white / european-american,24
74,skunk,"black with the long white stripe down its back, the smell it emits",it has the power of its smell to protect itself from predators,0,0,biological,female,white / european-american,24
74,vulture,"sharp beak, big wings, feathers",it is a predator that flies to find prey,0,0,biological,female,white / european-american,24
74,bee,"wings, stinger, black and yellow",it is an insect that transports pollen,0,0,biological,female,white / european-american,24
75,raccoon,it's dna.,it evolved and adapted overtime to increase it's species chances of survival.,0,0,biological,female,white / european-american,49
75,skunk,it's dna.,it evolved to be the way it is to increase it's odds of survival.,0,0,biological,female,white / european-american,49
75,vulture,it's dna.,it evolved and developed it's features through different generations to increase the species ability to survive.,0,0,biological,female,white / european-american,49
75,bee,it's dna.,it evolved and adapted to it's environment as a species so the species could survive.,0,0,biological,female,white / european-american,49
76,raccoon,little hands that can pick up food. fur patterns and a robust body sufficient for urban and rural survival. smart brains.,it has developed these features over time in order to adapt to nighttime foraging.,0,0,biological,female,white / european-american,46
76,skunk,black and white fur and ability to spray scent.,scent making abilities allow for it to repel enemies.,0,0,biological,female,white / european-american,46
76,vulture,long neck and expansive wingspan. sharp claws for tearing food.,the body of the bird has adapted over time to allow for it to successfully forage meat and sustain long periods of no food sources. it has sharp claw for tearing food.,0,0,biological,female,white / european-american,46
76,bee,wings and ability to fly.,"it allows bees to ""collect"" pollen for food from plants easily.",0,0,biological,female,white / european-american,46
77,raccoon,it's fur and it's claws,it's fur lets it hide easier in the dark and it's claw let it scavenge food easier.,0,0,biological,male,white / european-american,26
77,skunk,the white and black fur as well as the smell,it has them because that's what evolution decided it needed. the fur color for some reason and the stink sac to ward of predators.,0,0,biological,male,white / european-american,26
77,vulture,"it's talons, beak, and wings",it has the wings to fly and scope out food. it has the talons and beak to cut and eat it's food,0,0,biological,male,white / european-american,26
77,bee,the stinger,it has the feature due to evolution to sting attackers with venom.,0,0,biological,male,white / european-american,26
78,raccoon,"black band across eyes, rings on tail, fur, four-legged, rounded ears and whiskers",it lives outside and is nocturnal,0,0,biological,female,white / european-american,41
78,skunk,"black and white, ability to spray, tail",it protects itself with its bad smell,0,0,biological,female,white / european-american,41
78,vulture,"wings, feathers, claws, hooked beak, relatively ""bald"" head",it flies and scavenges,0,0,biological,female,white / european-american,41
78,bee,"wings, black and yellow stripes, stinger, antennae",it pollinates and protects the hive,0,0,biological,female,white / european-american,41
79,raccoon,the pattern on its face,i have no idea,0,0,biological,male,asian / asian-american,25
79,skunk,the stink spray and black and white pattern,it is for defense,0,0,biological,male,asian / asian-american,25
79,vulture,it's long neck and eating habits,it is a scavenger when it comes to food consumption,0,0,biological,male,asian / asian-american,25
79,bee,the color patterns and hive,living with a hive helps them survive,0,0,biological,male,asian / asian-american,25
80,raccoon,the striped features,it's genetic,0,0,biological,female,white / european-american,70
80,skunk,the white stripe down the back/tail along with the odor capabilities,it's in their genes,0,0,biological,female,white / european-american,70
80,vulture,they are the scavengers always ready to clean up animal debris.,it's probably ingrained or instinct.,0,0,biological,female,white / european-american,70
80,bee,their ability to pollinate,that's how it was designed by nature,0,0,biological,female,white / european-american,70
81,raccoon,"opposable thumbs, camoflague look",to pilfer through in the dark,0,0,biological,other / prefer not to answer,white / european-american,27
81,skunk,ability to produce smells,to protect itself,0,0,biological,other / prefer not to answer,white / european-american,27
81,vulture,big wings and beak,it's a predator,0,0,biological,other / prefer not to answer,white / european-american,27
81,bee,stinger,it's job is to protect the queen so it has the stinger to defend itself,0,0,biological,other / prefer not to answer,white / european-american,27
82,raccoon,it is very adaptable and likes trash.,survival.,0,0,biological,female,white / european-american,45
82,skunk,spraying when they are afraid.,it's afraid.,0,0,biological,female,white / european-american,45
82,vulture,eating roadkill.,survival.,0,0,biological,female,white / european-american,45
82,bee,they have a stinger that can sting.,it is trying to protect itself.,0,0,biological,female,white / european-american,45
83,raccoon,"the bandit looking face, little paws that can grip things","because its a racoon. paws help it acquire food(goin around through peoples trash cans , etc)",0,0,biological,male,white / european-american,27
83,skunk,white stripe on back. stink spray,to protect itself from predators,0,0,biological,male,white / european-american,27
83,vulture,long neck. large wings,to fly above prey it things is dying,0,0,biological,male,white / european-american,27
83,bee,yellow. wings. stinger,to fly from flower to flower. to protect itself,0,0,biological,male,white / european-american,27
84,raccoon,"the black mask of their eyes, furry striped tail, furry coat, can be mean","to protect itself from predators, born that way",0,0,biological,female,white / european-american,54
84,skunk,"they spray, black and white, furry, they stink",they spray to protect themselves from other predators.,0,0,biological,female,white / european-american,54
84,vulture,"its long neck, large size, wings",it is a bird it is common to have wings born that way.,0,0,biological,female,white / european-american,54
84,bee,"they can sting, colors yellow and black, insect can fly has wings",it was born that way,0,0,biological,female,white / european-american,54
85,raccoon,it's a beautiful creature that does not harm to people,it's beautiful fur and the exceptional mask like face.,0,0,biological,male,white / european-american,69
85,skunk,it's defense system,it's and ordinary animal with a superior way of keeping predators away,0,0,biological,male,white / european-american,69
85,vulture,it's large and scary looking,it's big scary ace and giant claws.,0,0,biological,male,white / european-american,69
85,bee,"pollinator, team player",ants to work for the queen because it is part of a community and it's respect for the queen,0,0,biological,male,white / european-american,69
86,raccoon,"a raccoon is typically grey.   its main feature is it's stripped tail, and its rings around its eyes.","the raccoon, i honestly do not have a major answer for this.   maybe the tail is to disguise itself.",0,0,biological,female,white / european-american,45
86,skunk,i think its coloring for sure.   the all black with the one single strip down its back.  the fact that they spray and they stink.,"the skunk has predators and is generally prey.   its white strip is to scare things off, but when they get too close, they get to spray with a stinky smell.",0,0,biological,female,white / european-american,45
86,vulture,"its huge talons, and the big beak, and the wing span.","vultures fly around looking for deal animals or animals about to die.   they use their claws to grasp the dead bodies, and their beaks to tear the flesh.",0,0,biological,female,white / european-american,45
86,bee,the wings so that they can fly.   the singer so that they can sting.   the small hairs on it so that it can spread the pollen.,the bee needs wings so that they can fly from flower to flower spreading pollen for everything to grow.   it needs the stinger because it has to protect itself.,0,0,biological,female,white / european-american,45
87,raccoon,"fuzzy, four legs, striped tail, upright ears, eye markings, claws, nose shape",natural selection?,0,0,biological,female,white / european-american,34
87,skunk,"furry, four legs, mammal, black and white stripe fur pattern, stinky",natural selection,0,0,biological,female,white / european-american,34
87,vulture,"scavenger, big bird, feather shape around the neck (its ""boa""), beak shape",natural selection...,0,0,biological,female,white / european-american,34
87,bee,"small, 3 part insect body (head, thorax, abdomen), 6 legs, compound eyes, yellow and fuzzy, has a stinger, hive behavior, pollinator","natural selection, in that these features were advantageous to its environment so as a species they were able to feed and reproduce.",0,0,biological,female,white / european-american,34
88,raccoon,the black eyes and black and gray tail stripes.,it has those features as a level of camouflage to protect itself.,0,0,biological,male,white / european-american,31
88,skunk,the skunks spray and black body with a white stripe.,it uses its spray to protect itself from predators in the wild.,0,0,biological,male,white / european-american,31
88,vulture,they have long talons and a perched neck.,these features are to allow it to eat and hunt what it needs to catch to stay alive.,0,0,biological,male,white / european-american,31
88,bee,its stinger and yellow colors.,the stinger is to protect itself and the yellow is to blend into the flowers around it.,0,0,biological,male,white / european-american,31
89,raccoon,striped eyes looks like a thief's mask,camouflage,0,0,biological,male,white / european-american,54
89,skunk,the white stripe down its back and its ability to spray,camouflage and protection,0,0,biological,male,white / european-american,54
89,vulture,its ugly beak and that it eats dead carcasses,it evolved into being road kill cleaners,0,0,biological,male,white / european-american,54
89,bee,"black and yellow stripes, they have painful stingers",camouflage and protection,0,0,biological,male,white / european-american,54
90,raccoon,"their face pattern, their tail coloration, and their front paws that are capable of gripping objects.",the patterns likely help it with camouflage and its paws are great for grabbing and handling food in ways that many animals cannot.,0,0,biological,male,asian / asian-american,37
90,skunk,its scent and the gland that allows it to spray its scent at threats.,it's almost certainly an advantage that keeps predators at bay,0,0,biological,male,asian / asian-american,37
90,vulture,"its wings, the shape of its neck, and the fact that they eat carrion.","few animals actively seek out decaying corpses to eat, so it fills that role without much competition. their necks seem like they are probably helpful for eating dead animals in some way",0,0,biological,male,asian / asian-american,37
90,bee,its wings and its stinger,it can easily fly from flower to flower to feed. its stinger helps protect its colony from threats.,0,0,biological,male,asian / asian-american,37
91,raccoon,the black spots around its eyes.,that's how the genetics of a typical racoon are made up.,0,0,biological,male,asian / asian-american,43
91,skunk,the smell it can produce.,the biology of different organisms.,0,0,biological,male,asian / asian-american,43
91,vulture,it's large wings.,that's the shape of its skeleton.,0,0,biological,male,asian / asian-american,43
91,bee,its ability to pollinate.,that's how their brains are programmed.,0,0,biological,male,asian / asian-american,43
92,raccoon,"their ""mask"" on their face. their tendency to raid trash cans.",it has those features to hide from predators.,0,0,biological,male,white / european-american,41
92,skunk,the most important features of a skunk that makes is a skunk are their scent glands where they spray and their stripes.,it has those features for defense. it is there to ward off would be predators.,0,0,biological,male,white / european-american,41
92,vulture,the featherless head.,it allows them to get into carcasses easier.,0,0,biological,male,white / european-american,41
92,bee,their stinger and colorations.,it make them stand out to predators to beware and to fend off predators.,0,0,biological,male,white / european-american,41
93,raccoon,i think their masked face makes them a raccoon,i am not sure why they have that feature.  some advantage for them,0,0,biological,male,white / european-american,51
93,skunk,the smell is the most important,they use it for defensive purposes,0,0,biological,male,white / european-american,51
93,vulture,the feathers make them a vulture,they use them for flight,0,0,biological,male,white / european-american,51
93,bee,the business end with the stinger,they use it for defensive purpose mostly,0,0,biological,male,white / european-american,51
94,raccoon,it has a characteristic mask for its face. it is gray and brown and has a striped tail.,nothing in particular about the raccoons appearance strikes me as being biologically important. perhaps the mask traps light at night so that it is easier for the raccoon to see?,0,0,biological,male,white / european-american,51
94,skunk,"the colors black and white, with a marked stripe on the back and its defense mechanism of spraying.",probably black so that it can scavenge at night and the spray is for defense.,0,0,biological,male,white / european-american,51
94,vulture,"it is big with strong legs, sharp claws, and a sharp beak. it also has a very pronounced posture.",i am guessing that strength is important because vultures are scavengers and need to be strong when tearing meat from carcasses and that's natural posture supports it being easier to be in this position while eating.,0,0,biological,male,white / european-american,51
94,bee,the bee is yellow with black and yellow stripes. it has a stinger has wings.,"honestly, i'm not certain what makes a bee a bee. i know that it has a stinger for defense, but it's a striping pattern. i am not sure why it has it. perhaps it's pattern to help it blend in case of predator gets in the hive.",0,0,biological,male,white / european-american,51
95,raccoon,its nose and eyes,raccoons need to be able to see at night and find food so it uses sight and smell.,0,0,biological,female,white / european-american,27
95,skunk,its ability to spray people or other animals.,"when a skunk feels threatened, they spray whatever is making them feel that way.",0,0,biological,female,white / european-american,27
95,vulture,"its size, wings, and predatory instincts.","it needs talons to hunt prey, and its wings and size help protect it from other birds.",0,0,biological,female,white / european-american,27
95,bee,its stinger and wings.,the bee needs its wings to fly and find pollen. it stings when it feels threatened to protect itself.,0,0,biological,female,white / european-american,27
96,raccoon,the dark around the eyes.,probably helps them see better at night.,0,0,biological,male,white / european-american,46
96,skunk,its tail.,it gives a warning to other animals to stay away.,0,0,biological,male,white / european-american,46
96,vulture,"long, unfeathered neck.","they rip apart recently deceased carcasses, so it might be to keep blood and tissue from sticking to them.",0,0,biological,male,white / european-american,46
96,bee,the hairs on its body.,it is probably so it can carry more pollen back to its hive.,0,0,biological,male,white / european-american,46
97,raccoon,"the striped tail, the black fur around the eyes, the face shape and fur pattern.","it seems to have darker colored fur to blend into the night since they're nocturnal animals. maybe the black markings on the eyes make it more intimidating to other animals. i'm not sure why it has the striped tail, maybe it's random or sends some kind of message to other animals.",0,0,biological,female,latino / hispanic,26
97,skunk,"the white stripe on the back, the fluffy tail, the black and white fur","a skunk is a mammal primarily. it walks on four legs, has a bushy tail, and has black and white fur. they have distinctive white stripes on their backs. it being a mammal is why it has fur. i'm not sure why it has the stripe honestly. maybe the stripe is to warn predators that it has a defense mechanism. the bushy tail is long and can be raised to spray other animals when it's afraid.",0,0,biological,female,latino / hispanic,26
97,vulture,they are large birds with hunched necks. there are very few feathers on the head and neck.,maybe it has fewer feathers on its head and neck because it eats roadkill and it would get bloody an dirty otherwise. it's large because it's a bird of prey.,0,0,biological,female,latino / hispanic,26
97,bee,"it is black and yellow with a striped pattern on its body. it has a stinger, wings, and antennae.",the antennae and wings are a common feature of insects. the yellow and black stripe could be a warning sign to other animals that they can attack or don't taste good. the stinger is used as a defense mechanism.,0,0,biological,female,latino / hispanic,26
98,raccoon,the black eye mask.,i don't know what the black eye mask does. maybe it helps hide the eyes at night?,0,0,biological,male,white / european-american,45
98,skunk,the smell and a black body with two white strips down it's back.,the smell is a defense against predators. the coloring is a warning to other animals that it will spray you.,0,0,biological,male,white / european-american,45
98,vulture,"its wings, long neck, sharp beak and talons.","it uses its wings to fly, giving it a greater expanse and view to find dead or dying animals. the sharp beak and talons are to rip flesh from the dead animals. i don't know why the long neck. maybe to be able to stretch to get at the food with other animals around?",0,0,biological,male,white / european-american,45
98,bee,its stinger and yellow and black coloring.,"the stinger is for protection. i don't know about the yellow and black body, but maybe to warn other animals that it can sting them?",0,0,biological,male,white / european-american,45
99,raccoon,"the raccoon's distinctive fur pattern with masked eyes and banded tail, and its dexterous hands are its most important features.",the fur pattern indicates the species and the dexterous hands enable it to manipulate objects better than most other non-primate mammals.,0,0,biological,female,white / european-american,39
99,skunk,the most distinctive features of the skunk are its eye-catching fur pattern and its musk gland.,the fur pattern and musk gland are both defensive features that warn potential predators not to bother the skunk.,0,0,biological,female,white / european-american,39
99,vulture,the most important features of the vulture are the wings and featherless beaked head.,"the wings allow the vulture to fly, and the featherless beaked head allow it to consume its diet of carrion.",0,0,biological,female,white / european-american,39
99,bee,the wings and striped color pattern are the most distinctive features of the bee.,it utilizes its wings to fly between plants and gather pollen. the colors are a warning to predators.,0,0,biological,female,white / european-american,39
100,raccoon,face,nature,0,0,biological,female,latino / hispanic,63
100,skunk,colors and smell,defense mechanism,0,0,biological,female,latino / hispanic,63
100,vulture,eating dead flesh,someone has to eat roadkill,0,0,biological,female,latino / hispanic,63
100,bee,honey,nature,0,0,biological,female,latino / hispanic,63
101,raccoon,their face with the black and white fur color that make them distinctive,may be they use their color of fur as camouflage so they can get  where they want,0,0,biological,female,asian / asian-american,64
101,skunk,their smelly spray,they spray in last resort for self defense,0,0,biological,female,asian / asian-american,64
101,vulture,sharp beak,so it can rip apart hip prey no matter what size they are,0,0,biological,female,asian / asian-american,64
101,bee,their buzzing sound and stinger,to keep they preys away,0,0,biological,female,asian / asian-american,64
102,raccoon,it's claws and eyes.,to allow it to climb and see in the dark.,0,0,biological,male,white / european-american,56
102,skunk,it's anal gland used for defense.,"to stay alive, it uses a spray from the anal gland to drive predators away.",0,0,biological,male,white / european-american,56
102,vulture,"they have a sharp beak and talons, feathers, wings, a long drooping neck, and ugly af.","to rip the flesh from the bons of their prey, much like corporations.",0,0,biological,male,white / european-american,56
102,bee,its stinger and the ability to make process pollen.,to generate food for the hive.,0,0,biological,male,white / european-american,56
103,raccoon,it's ability to climb.,it was given to them by our creator.,0,0,biological,male,black / african american,36
103,skunk,it's defensive method of spraying.,it's was given to them by our creator.,0,0,biological,male,black / african american,36
103,vulture,it's method of eating dead animals after other animals finish eating their meals.,it's a survival tactic by them.,0,0,biological,male,black / african american,36
103,bee,it's ability to sting.,it was given to them by our creator.,0,0,biological,male,black / african american,36
104,raccoon,the striped eyes and tail.,i'm not sure why they evolved that way.  it's not good camouflage.  it's not a good warning to predators.  i guess evolution just thought it was cute lol,0,0,biological,male,white / european-american,40
104,skunk,the white stripe down its black back.  though some might say the smell when it sprays.,"definitely a warning to predators, both the stark color pattern as well as the smell.  skunks don't stink (to me) but it is a very strong smell which other animals don't like.  most animals have very sensitive noses and such a powerful odor basically blinds their noses.",0,0,biological,male,white / european-american,40
104,vulture,the skinny neck poking out of a fluffy body.,it's got to reach into the gooey holes poked into a dead body.  yum lol,0,0,biological,male,white / european-american,40
104,bee,the big striped butt and large oval eyes.  and of course the yellow fur.,i think it is most likely a warning to predators to stay away.,0,0,biological,male,white / european-american,40
105,raccoon,obviously the mask it wears and the striped tail identify him but the way their fingers work is fascinating.,camouflage maybe?,0,0,biological,female,white / european-american,47
105,skunk,"appearance wise it's stripe down the middle of his back, but in general it would be the scent of course.",i believe it's to ward off predators? i don't know why the stripe is there.,0,0,biological,female,white / european-american,47
105,vulture,the hair necklace around it's neck makes it recognizable but i think the curved beak and the talons are the main things.,to be able to rip apart it's food which is usually the fresh remains of some poor animal.,0,0,biological,female,white / european-american,47
105,bee,"the stinger, the yellow and black stripes.",the stinger for protection but only some types of bees can sting multiple times. i have no idea why they have yellow and black stripes. i'll probably google that later.,0,0,biological,female,white / european-american,47
106,raccoon,their coloring features and their paws.,"with their paws, they can grasp and dig.  their coloring, the mask around the eyes and the rings around the tail, let everyone know they are a raccoon.",0,0,biological,female,white / european-american,76
106,skunk,the ability to spray an odor.,it is for protection.,0,0,biological,female,white / european-american,76
